id,difficulté,question,liste_reponses,indice
292,4,Comment traduit-on "Je suis perdu" en anglais ?,i am lost;1,Le mot lost est dedans
293,4,Que signifie "to listen" en français ?,écouter;1,Ce que tu fais avec tes oreilles
294,4,Comment dit-on "Il neige" en anglais ?,it is snowing;1,Le mot snowing est dedans
295,4,Quel est le contraire de "happy" en anglais ?,sad;1,Le contraire de joyeux
296,4,Comment traduit-on "Je suis prêt" en anglais ?,i am ready;1,Le mot ready est dedans
297,4,Que signifie "to learn" en français ?,apprendre;1,Ce que tu fais en ce moment
298,4,Comment dit-on "Je suis malade" en anglais ?,i am sick;1,Le mot sick est dedans
299,4,Quel est le contraire de "big" en anglais ?,small;1,C'est plus petit
300,4,Comment traduit-on "Je vais bien" en anglais ?,i am fine;1,Le mot fine est dedans